{
  "schema_version": "1.0.0",
  "run_id": "run-2026-10-18-0a1b2c",
  "audit_id": "fixture",
  "generated_by": "diligent-inventory/0.2.1",
  "routes": [
    {
      "url": "https://example.gov/",
      "cluster_id": "f465c3739385",
      "sources": [
        "sitemap",
        "start"
      ],
      "fetched": false,
      "status": null,
      "final_url": null,
      "title": null,
      "has_form": false,
      "lastmod": null,
      "excluded_by_robots": true,
      "unreachable": null
    },
    {
      "url": "https://example.gov/about",
      "cluster_id": "8e88c08a818f",
      "sources": [
        "sitemap"
      ],
      "fetched": false,
      "status": null,
      "final_url": null,
      "title": null,
      "has_form": false,
      "lastmod": null,
      "excluded_by_robots": true,
      "unreachable": null
    },
    {
      "url": "https://example.gov/news/2026/one",
      "cluster_id": "332b67e05738",
      "sources": [
        "sitemap"
      ],
      "fetched": false,
      "status": null,
      "final_url": null,
      "title": null,
      "has_form": false,
      "lastmod": null,
      "excluded_by_robots": true,
      "unreachable": null
    },
    {
      "url": "https://example.gov/news/2026/two",
      "cluster_id": "7fc725b62038",
      "sources": [
        "sitemap"
      ],
      "fetched": false,
      "status": null,
      "final_url": null,
      "title": null,
      "has_form": false,
      "lastmod": null,
      "excluded_by_robots": true,
      "unreachable": null
    },
    {
      "url": "https://example.gov/services/apply",
      "cluster_id": "4f08225b4b5a",
      "sources": [
        "sitemap"
      ],
      "fetched": false,
      "status": null,
      "final_url": null,
      "title": null,
      "has_form": false,
      "lastmod": null,
      "excluded_by_robots": true,
      "unreachable": null
    },
    {
      "url": "https://example.gov/services/renew",
      "cluster_id": "4859939d4428",
      "sources": [
        "sitemap"
      ],
      "fetched": false,
      "status": null,
      "final_url": null,
      "title": null,
      "has_form": false,
      "lastmod": null,
      "excluded_by_robots": true,
      "unreachable": null
    }
  ],
  "templates": [
    {
      "cluster_id": "f465c3739385",
      "path_shape": "/",
      "dom_shape": null,
      "size": 1,
      "representative": "https://example.gov/",
      "fetched_members": 0
    },
    {
      "cluster_id": "8e88c08a818f",
      "path_shape": "/about",
      "dom_shape": null,
      "size": 1,
      "representative": "https://example.gov/about",
      "fetched_members": 0
    },
    {
      "cluster_id": "332b67e05738",
      "path_shape": "/news/{n}/one",
      "dom_shape": null,
      "size": 1,
      "representative": "https://example.gov/news/2026/one",
      "fetched_members": 0
    },
    {
      "cluster_id": "7fc725b62038",
      "path_shape": "/news/{n}/two",
      "dom_shape": null,
      "size": 1,
      "representative": "https://example.gov/news/2026/two",
      "fetched_members": 0
    },
    {
      "cluster_id": "4f08225b4b5a",
      "path_shape": "/services/apply",
      "dom_shape": null,
      "size": 1,
      "representative": "https://example.gov/services/apply",
      "fetched_members": 0
    },
    {
      "cluster_id": "4859939d4428",
      "path_shape": "/services/renew",
      "dom_shape": null,
      "size": 1,
      "representative": "https://example.gov/services/renew",
      "fetched_members": 0
    }
  ],
  "components": [],
  "documents": [
    {
      "url": "https://example.gov/files/report.pdf",
      "kind": "pdf"
    }
  ],
  "vendors": [],
  "roles": [],
  "states": [],
  "discovery_limits": [
    "roles_and_states: a fetch-only crawler sees one anonymous role and one default state; authenticated roles and interactive states are not inventoried",
    "client_rendered_navigation_not_followed: links created by JavaScript are not discovered",
    "robots_excluded: 6 urls",
    "rate_limit: at most 2 requests per second (500 ms between requests), one request at a time",
    "documents_not_fetched: 1 documents",
    "robots_excluded_all: start URL disallowed; no page fetched; the FED-18 robots check carries the finding",
    "partial: true",
    "remaining_work: start URL disallowed by robots.txt: no page was fetched"
  ]
}
