{
  "schema_version": "1.0.0",
  "run_id": "run-2026-10-18-0a1b2c",
  "audit_id": "fixture",
  "generated_by": "diligent-inventory/0.2.1",
  "routes": [
    {
      "url": "https://example.gov/",
      "cluster_id": "8f306e3de160",
      "sources": [
        "link",
        "start"
      ],
      "fetched": true,
      "status": 200,
      "final_url": "https://example.gov/",
      "title": "Home",
      "has_form": false,
      "lastmod": null,
      "excluded_by_robots": false,
      "unreachable": null
    },
    {
      "url": "https://example.gov/a/p-1",
      "cluster_id": "44c4e61862c0",
      "sources": [
        "robots_sitemap"
      ],
      "fetched": true,
      "status": 200,
      "final_url": "https://example.gov/a/p-1",
      "title": "Page p-1",
      "has_form": false,
      "lastmod": "2026-01-01",
      "excluded_by_robots": false,
      "unreachable": null
    },
    {
      "url": "https://example.gov/a/p-2",
      "cluster_id": "44c4e61862c0",
      "sources": [
        "robots_sitemap"
      ],
      "fetched": true,
      "status": 200,
      "final_url": "https://example.gov/a/p-2",
      "title": "Page p-2",
      "has_form": false,
      "lastmod": "2026-02-01",
      "excluded_by_robots": false,
      "unreachable": null
    },
    {
      "url": "https://example.gov/a/p-3",
      "cluster_id": "44c4e61862c0",
      "sources": [
        "robots_sitemap"
      ],
      "fetched": true,
      "status": 200,
      "final_url": "https://example.gov/a/p-3",
      "title": "Page p-3",
      "has_form": false,
      "lastmod": "2026-03-01",
      "excluded_by_robots": false,
      "unreachable": null
    },
    {
      "url": "https://example.gov/a/p-4",
      "cluster_id": "44c4e61862c0",
      "sources": [
        "robots_sitemap"
      ],
      "fetched": true,
      "status": 200,
      "final_url": "https://example.gov/a/p-4",
      "title": "Page p-4",
      "has_form": false,
      "lastmod": "2026-04-01",
      "excluded_by_robots": false,
      "unreachable": null
    },
    {
      "url": "https://example.gov/about",
      "cluster_id": "f1e9a4008e24",
      "sources": [
        "link"
      ],
      "fetched": true,
      "status": 404,
      "final_url": "https://example.gov/about",
      "title": null,
      "has_form": false,
      "lastmod": null,
      "excluded_by_robots": false,
      "unreachable": null
    },
    {
      "url": "https://example.gov/b/p-1",
      "cluster_id": "57091bd9b4d5",
      "sources": [
        "robots_sitemap"
      ],
      "fetched": true,
      "status": 200,
      "final_url": "https://example.gov/b/p-1",
      "title": "Page p-1",
      "has_form": false,
      "lastmod": null,
      "excluded_by_robots": false,
      "unreachable": null
    },
    {
      "url": "https://example.gov/b/p-2",
      "cluster_id": "57091bd9b4d5",
      "sources": [
        "robots_sitemap"
      ],
      "fetched": true,
      "status": 200,
      "final_url": "https://example.gov/b/p-2",
      "title": "Page p-2",
      "has_form": false,
      "lastmod": null,
      "excluded_by_robots": false,
      "unreachable": null
    },
    {
      "url": "https://example.gov/b/p-3",
      "cluster_id": "57091bd9b4d5",
      "sources": [
        "robots_sitemap"
      ],
      "fetched": true,
      "status": 200,
      "final_url": "https://example.gov/b/p-3",
      "title": "Page p-3",
      "has_form": false,
      "lastmod": null,
      "excluded_by_robots": false,
      "unreachable": null
    }
  ],
  "templates": [
    {
      "cluster_id": "44c4e61862c0",
      "path_shape": "/a/{slug}",
      "dom_shape": "L=header,nav,main,footer;h1=1;h2=0;submit_form=0;data_table=0",
      "size": 4,
      "representative": "https://example.gov/a/p-1",
      "fetched_members": 4
    },
    {
      "cluster_id": "57091bd9b4d5",
      "path_shape": "/b/{slug}",
      "dom_shape": "L=header,nav,main,footer;h1=1;h2=0;submit_form=0;data_table=0",
      "size": 3,
      "representative": "https://example.gov/b/p-1",
      "fetched_members": 3
    },
    {
      "cluster_id": "8f306e3de160",
      "path_shape": "/",
      "dom_shape": "L=header,nav,main,footer;h1=1;h2=0;submit_form=0;data_table=0",
      "size": 1,
      "representative": "https://example.gov/",
      "fetched_members": 1
    },
    {
      "cluster_id": "f1e9a4008e24",
      "path_shape": "/about",
      "dom_shape": "L=;h1=0;h2=0;submit_form=0;data_table=0",
      "size": 1,
      "representative": "https://example.gov/about",
      "fetched_members": 1
    }
  ],
  "components": [],
  "documents": [],
  "vendors": [],
  "roles": [],
  "states": [],
  "discovery_limits": [
    "roles_and_states: a fetch-only crawler sees one anonymous role and one default state; authenticated roles and interactive states are not inventoried",
    "client_rendered_navigation_not_followed: links created by JavaScript are not discovered",
    "robots_excluded: 0 urls",
    "rate_limit: at most 2 requests per second (500 ms between requests), one request at a time",
    "off_scope: 3 urls on other origins were not inventoried",
    "sitemap_skipped: http://10.0.0.5/sitemap.xml (off scope)",
    "sitemap_invalid_loc: https://example.gov/sitemap-b.xml (2 entries without a usable http(s) loc)",
    "sitemap_skipped: https://other.example/sitemap.xml (off scope)",
    "partial: false"
  ]
}
